{
  "chapter_name": "Η ΟΙΚΙΑ",
  "word_list_page_number": 102,
  "exercise_page_range": [
    98,
    101
  ],
  "sections": [
    {
      "section": "Ῥήματα",
      "words": [
        {
          "book_entry": "ᾄδω"
        },
        {
          "book_entry": "ἀναγιγνώσκω"
        },
        {
          "book_entry": "ἀναπαύομαι"
        },
        {
          "book_entry": "ἄπειμι"
        },
        {
          "book_entry": "διατρίβω"
        },
        {
          "book_entry": "δύει"
        },
        {
          "book_entry": "εὑρίσκω"
        },
        {
          "book_entry": "ἔχω"
        },
        {
          "book_entry": "ζητέω"
        },
        {
          "book_entry": "θεραπεύω"
        },
        {
          "book_entry": "καθεύδω"
        },
        {
          "book_entry": "καλέω"
        },
        {
          "book_entry": "κτενίζω"
        },
        {
          "book_entry": "λαμβάνω"
        },
        {
          "book_entry": "λείπω"
        },
        {
          "book_entry": "λούω, -ομαι"
        },
        {
          "book_entry": "μαγειρεύω"
        },
        {
          "book_entry": "ὁράω"
        },
        {
          "book_entry": "παρασκευάζω"
        },
        {
          "book_entry": "πάρειμι"
        },
        {
          "book_entry": "ῥάπτω"
        },
        {
          "book_entry": "τρέφω"
        },
        {
          "book_entry": "φιλέω"
        }
      ]
    },
    {
      "section": "Προθέσεις",
      "words": [
        {
          "book_entry": "κατά (κατ ̓ οἰκον)"
        }
      ]
    },
    {
      "section": "Ὀνόματα",
      "words": [
        {
          "book_entry": "ἀνδρωνῖτις, ἡ"
        },
        {
          "book_entry": "ἀποθήκη, ἡ"
        },
        {
          "book_entry": "αὐλή, ἡ"
        },
        {
          "book_entry": "αὔλιον, τό"
        },
        {
          "book_entry": "βιβλιοθήκη, ἡ"
        },
        {
          "book_entry": "βιβλίον, τό"
        },
        {
          "book_entry": "βωμός, ὁ"
        },
        {
          "book_entry": "γυναικωνῖτις, ἡ"
        },
        {
          "book_entry": "δεῖπνον, τό"
        },
        {
          "book_entry": "δωμάτιον, τό"
        },
        {
          "book_entry": "ἐπιστολή, ἡ"
        },
        {
          "book_entry": "ἔργον, τό"
        },
        {
          "book_entry": "ἑσπέρα, ἡ"
        },
        {
          "book_entry": "ἡμέρα, ῆ"
        },
        {
          "book_entry": "θάλαμος, ὁ"
        },
        {
          "book_entry": "θρόνος, ὁ"
        },
        {
          "book_entry": "θύρα, ἡ"
        },
        {
          "book_entry": "θυρίς, ἡ"
        },
        {
          "book_entry": "καθέδρα, ἡ"
        },
        {
          "book_entry": "κάλαμος, ὁ"
        },
        {
          "book_entry": "κῆπος, ὁ"
        },
        {
          "book_entry": "κιβώτιον, τό"
        },
        {
          "book_entry": "κιθάρα, ἡ"
        },
        {
          "book_entry": "κλίμαξ, ἡ"
        },
        {
          "book_entry": "κλίνη, ἡ"
        },
        {
          "book_entry": "κόμη, ἡ"
        },
        {
          "book_entry": "λουτρόν, τό"
        },
        {
          "book_entry": "μαγειρεῖον, τό"
        },
        {
          "book_entry": "μῆλον, τό"
        },
        {
          "book_entry": "νύξ, ἡ"
        },
        {
          "book_entry": "ξύλον, τό"
        },
        {
          "book_entry": "ὄνειρον, τό"
        },
        {
          "book_entry": "πάπυρος, ὁ"
        },
        {
          "book_entry": "πέπλος, ὁ"
        },
        {
          "book_entry": "περιστύλιον, τό"
        },
        {
          "book_entry": "στῦλος, ὁ"
        },
        {
          "book_entry": "συμπόσιον, τό"
        },
        {
          "book_entry": "τράπεζα, ἡ"
        },
        {
          "book_entry": "τροφή, ἡ"
        },
        {
          "book_entry": "ὕπνος, ὁ"
        }
      ]
    },
    {
      "section": "Ἐπίθετα",
      "words": [
        {
          "book_entry": "αἰτιατικός, -ή, -όν"
        },
        {
          "book_entry": "διπλοῦς, -ῆ, -οῦν"
        },
        {
          "book_entry": "_κλητικός, -ή, -όν_"
        },
        {
          "book_entry": "ξύλινος, -η, -ον"
        },
        {
          "book_entry": "περίστυλος, -ον"
        }
      ]
    },
    {
      "section": "Ἐπιρρήματα",
      "words": [
        {
          "book_entry": "ἅμα"
        },
        {
          "book_entry": "ἤδη"
        },
        {
          "book_entry": "καλῶς"
        },
        {
          "book_entry": "τέλος"
        }
      ]
    },
    {
      "section": "Ἐπιρωνήματα",
      "words": [
        {
          "book_entry": "ὦ!"
        }
      ]
    }
  ]
}