{
  "chapter_name": "ΤΑ ΜΗΔΙΚΑ",
  "word_list_page_number": 339,
  "exercise_page_range": [
    335,
    338
  ],
  "sections": [
    {
      "section": "Ῥήματα",
      "words": [
        {
          "book_entry": "ἀγγέλλω"
        },
        {
          "book_entry": "ἀναμιμνήσκω"
        },
        {
          "book_entry": "ἀντέχω, -ομαι"
        },
        {
          "book_entry": "ἀπεικονίζω"
        },
        {
          "book_entry": "ἄπειμι (< εἶμι)"
        },
        {
          "book_entry": "ἀποστέλλω"
        },
        {
          "book_entry": "ἀφίστημι"
        },
        {
          "book_entry": "δηλόω"
        },
        {
          "book_entry": "διαπεραιόω, -ομαι"
        },
        {
          "book_entry": "δουλόω"
        },
        {
          "book_entry": "δράω"
        },
        {
          "book_entry": "ἐκλείπω"
        },
        {
          "book_entry": "ἐπαινέω"
        },
        {
          "book_entry": "ἐρύω"
        },
        {
          "book_entry": "ἐφίσταμαι"
        },
        {
          "book_entry": "ἡττάομαι"
        },
        {
          "book_entry": "θρηνέω"
        },
        {
          "book_entry": "καταλαμβάνω"
        },
        {
          "book_entry": "καταφρονέω"
        },
        {
          "book_entry": "κωλύω"
        },
        {
          "book_entry": "μάχομαι"
        },
        {
          "book_entry": "ὄλλυμι"
        },
        {
          "book_entry": "προάγω"
        },
        {
          "book_entry": "προκαταλαμβάνω, -ομαι"
        },
        {
          "book_entry": "συμβουλεύω"
        },
        {
          "book_entry": "συναγωνίζομαι"
        },
        {
          "book_entry": "συνέρχομαι"
        }
      ]
    },
    {
      "section": "Ὀνόματα",
      "words": [
        {
          "book_entry": "ἀγωνία, ἡ"
        },
        {
          "book_entry": "ἀθυμία, ἡ"
        },
        {
          "book_entry": "αἰτία, ἡ"
        },
        {
          "book_entry": "ἀνδριάς, ὁ"
        },
        {
          "book_entry": "ἀπάντησις, ἡ"
        },
        {
          "book_entry": "ἀπόστασις, ἡ"
        },
        {
          "book_entry": "δουλοσύνη, ἡ"
        },
        {
          "book_entry": "εἴδωλον, τό"
        },
        {
          "book_entry": "ἧττα, ἡ"
        },
        {
          "book_entry": "θρήνος, ὁ"
        },
        {
          "book_entry": "πάροδος, ἡ"
        },
        {
          "book_entry": "πεζομαχία, ἡ"
        },
        {
          "book_entry": "σπουδή, ἡ"
        },
        {
          "book_entry": "συναγώνισμα, τό"
        },
        {
          "book_entry": "σύνοδος, ἡ"
        },
        {
          "book_entry": "ὑπόθεσις, ἡ"
        }
      ]
    },
    {
      "section": "Κύρια ὀνόματα",
      "words": [
        {
          "book_entry": "Πλαταιαί, αἱ"
        }
      ]
    },
    {
      "section": "Ἀντωνυμίαι",
      "words": [
        {
          "book_entry": "οἷος, -α, -ον"
        }
      ]
    },
    {
      "section": "Ἐπίθετα",
      "words": [
        {
          "book_entry": "βοηθός, -όν"
        },
        {
          "book_entry": "ἐλάσσων, -ον"
        },
        {
          "book_entry": "εὔθετος, -ον"
        },
        {
          "book_entry": "ἱκανός, -ή, -όν"
        },
        {
          "book_entry": "λίθινος, -η, -ον"
        },
        {
          "book_entry": "ναυτικός, -ἡ, -όν"
        },
        {
          "book_entry": "ταπεινός, -ή, -όν"
        },
        {
          "book_entry": "τραγικός, -ή, -όν"
        },
        {
          "book_entry": "τριταῖος, -α, -ον"
        }
      ]
    },
    {
      "section": "Ἀριθμοί",
      "words": [
        {
          "book_entry": "δισχίλιοι, -αι, -α"
        },
        {
          "book_entry": "ἐνενήκοντα"
        },
        {
          "book_entry": "ἑξακισχίλιοι, -αι, -α"
        },
        {
          "book_entry": "τετρακόσιοι, -αι, -α"
        }
      ]
    },
    {
      "section": "Ἐπιρρήματα",
      "words": [
        {
          "book_entry": "ἀνδρειότατα"
        },
        {
          "book_entry": "ἐγγύς"
        }
      ]
    },
    {
      "section": "Μόρια",
      "words": [
        {
          "book_entry": "τοιγάρ"
        }
      ]
    }
  ]
}