{
  "chapter_name": "ΘΕΟΙ, ΑΝΘΡΩΠΟΙ ΚΑΙ ΘΗΡΙΑ",
  "word_list_page_number": 24,
  "exercise_page_range": [
    21,
    23
  ],
  "sections": [
    {
      "section": "Ῥήματα",
      "words": [
        {
          "book_entry": "ἐστίν | εἰσίν"
        }
      ]
    },
    {
      "section": "Ἀντωνυμίαι",
      "words": [
        {
          "book_entry": "τίς;"
        }
      ]
    },
    {
      "section": "Ὀνόματα",
      "words": [
        {
          "book_entry": "ἄνθρωπος, ὁ / ἡ"
        },
        {
          "book_entry": "ἄρθρον, τό"
        },
        {
          "book_entry": "ἀριθμός, ὁ"
        },
        {
          "book_entry": "βασίλεια, ἡ"
        },
        {
          "book_entry": "γραμματική, ἡ"
        },
        {
          "book_entry": "θεά, ἡ"
        },
        {
          "book_entry": "θεός, ὁ"
        },
        {
          "book_entry": "θηρίον, τό"
        },
        {
          "book_entry": "ἱέρεια, ἡ"
        },
        {
          "book_entry": "κεφάλαιον, τό"
        },
        {
          "book_entry": "μαθηματικός, ὁ"
        },
        {
          "book_entry": "μελέτημα, τό"
        },
        {
          "book_entry": "μουσικός, ὁ"
        },
        {
          "book_entry": "ποιήτρια, ἡ"
        },
        {
          "book_entry": "φιλόσοφος, ὁ"
        }
      ]
    },
    {
      "section": "Μόρια",
      "words": [
        {
          "book_entry": "δέ"
        },
        {
          "book_entry": "μέν"
        }
      ]
    },
    {
      "section": "Ἐπίθετα",
      "words": [
        {
          "book_entry": "Ἑλληνικός, -ή, -όν"
        },
        {
          "book_entry": "ἑνικός, -ἤ, -όν"
        },
        {
          "book_entry": "πληθυντικός, -ή, -όν"
        },
        {
          "book_entry": "Ρωμαϊκός, -ή, -όν"
        }
      ]
    },
    {
      "section": "Ἐπρρήματα",
      "words": [
        {
          "book_entry": "ἆρα;"
        },
        {
          "book_entry": "ναί"
        },
        {
          "book_entry": "οὐ | οὐκ | οὐχ"
        },
        {
          "book_entry": "οὐδαμῶς"
        }
      ]
    },
    {
      "section": "Ἄρθρον",
      "words": [
        {
          "book_entry": "ὁ, ἡ"
        }
      ]
    },
    {
      "section": "Σύνδεσμοι",
      "words": [
        {
          "book_entry": "ἀλλά"
        },
        {
          "book_entry": "καί"
        }
      ]
    },
    {
      "section": "Κύρια ὀνόματα",
      "words": [
        {
          "book_entry": "Ἀθηνᾶ, ἡ"
        },
        {
          "book_entry": "Ἀπόλλων, ὁ"
        },
        {
          "book_entry": "Ἄρης, ὁ"
        },
        {
          "book_entry": "Ἄρτεμις, ἡ"
        },
        {
          "book_entry": "Ἀστερίων, ὁ"
        },
        {
          "book_entry": "Ἀφροδίτη, ἡ"
        },
        {
          "book_entry": "Δημήτηρ, ἡ"
        },
        {
          "book_entry": "Διόνυσος, ὁ"
        },
        {
          "book_entry": "Διοτίμα, ἡ"
        },
        {
          "book_entry": "Ἑρμῆς, ὁ"
        },
        {
          "book_entry": "Ἥφαιστος, ὁ"
        },
        {
          "book_entry": "Ζεύς, ὁ"
        },
        {
          "book_entry": "Ἥρα, ἡ"
        },
        {
          "book_entry": "Κέρβερος, ὁ"
        },
        {
          "book_entry": "Κλεοπάτρα, ἡ"
        },
        {
          "book_entry": "Κόριννα, ἡ"
        },
        {
          "book_entry": "Μέδουσα, ἣ"
        },
        {
          "book_entry": "Ὀρφεύς, ὁ"
        },
        {
          "book_entry": "Περσεφόνη, ἡ"
        },
        {
          "book_entry": "Πήγασος, ὁ"
        },
        {
          "book_entry": "Πλάτων, ὁ"
        },
        {
          "book_entry": "Ποδάργη, ἡ"
        },
        {
          "book_entry": "Πολύφημος, ὁ"
        },
        {
          "book_entry": "Πυθαγόρας, ὁ"
        },
        {
          "book_entry": "Ὕδρα, ἡ"
        },
        {
          "book_entry": "Χείρων, ὁ"
        },
        {
          "book_entry": "Χίμαιρα, ἡ"
        }
      ]
    }
  ]
}