{
  "chapter_name": "ΓΛΩΣΣΑ ΚΑΙ ΔΙΑΛΕΚΤΟΙ",
  "word_list_page_number": 274,
  "exercise_page_range": [
    269,
    273
  ],
  "sections": [
    {
      "section": "Ὀνόματα",
      "words": [
        {
          "book_entry": "ἀπόγονος, ὁ",
          "first_occurrence": [
            52,
            5
          ]
        },
        {
          "book_entry": "ἀρχηγέτης, ὁ",
          "first_occurrence": [
            60,
            1
          ]
        },
        {
          "book_entry": "γενάρχης, ὁ",
          "first_occurrence": [
            68,
            2
          ]
        },
        {
          "book_entry": "διάλεκτος, ἡ",
          "first_occurrence": [
            100,
            1
          ]
        },
        {
          "book_entry": "ἡγεμονία, ἡ",
          "first_occurrence": [
            89,
            6
          ]
        },
        {
          "book_entry": "ἱστοριογράφος, ὁ",
          "first_occurrence": [
            109,
            2
          ]
        },
        {
          "book_entry": "κάτοικος, ὁ",
          "first_occurrence": [
            46,
            7
          ]
        },
        {
          "book_entry": "παροιμία, ἡ"
        },
        {
          "book_entry": "ῥήτωρ, ὁ",
          "first_occurrence": [
            88,
            2
          ]
        },
        {
          "book_entry": "τόπος, ὁ",
          "first_occurrence": [
            21,
            3
          ]
        },
        {
          "book_entry": "φυλή, ἡ",
          "first_occurrence": [
            59,
            6
          ]
        },
        {
          "book_entry": "χώρος, ὁ",
          "first_occurrence": [
            63,
            6
          ]
        }
      ]
    },
    {
      "section": "Κύρια ὀνόματα",
      "words": [
        {
          "book_entry": "Αἴολος, ὁ"
        },
        {
          "book_entry": "Ἀλκαῖος, ὁ"
        },
        {
          "book_entry": "Ἀλκμάν, ὁ"
        },
        {
          "book_entry": "Ἀχαία, ἡ"
        },
        {
          "book_entry": "Γραικός, ὁ"
        },
        {
          "book_entry": "Δωρίς, ἡ"
        },
        {
          "book_entry": "Δῶρος, ὁ"
        },
        {
          "book_entry": "Ἕλλην, ὁ"
        },
        {
          "book_entry": "Ζήνων, ὁ"
        },
        {
          "book_entry": "Θήρα, ἡ"
        },
        {
          "book_entry": "Θυία, ἡ"
        },
        {
          "book_entry": "Κίτιον, τό"
        },
        {
          "book_entry": "Κρέουσα, ἡ"
        },
        {
          "book_entry": "Ξούθος, ὁ"
        },
        {
          "book_entry": "Πίνδαρος, ὁ"
        },
        {
          "book_entry": "Φθία. ἡ"
        }
      ]
    },
    {
      "section": "Ἐπίθετα",
      "words": [
        {
          "book_entry": "Αἰολεύς, Αἰολίς",
          "first_occurrence": [
            39,
            2
          ]
        },
        {
          "book_entry": "αἰολικός. -ή, -όν",
          "first_occurrence": [
            99,
            6
          ]
        },
        {
          "book_entry": "Ἁλικαρνασσεύς, -ίς",
          "first_occurrence": [
            109,
            1
          ]
        },
        {
          "book_entry": "ἄριστος, -η, -ον",
          "first_occurrence": [
            87,
            7
          ]
        },
        {
          "book_entry": "ἀρχαῖος, -α, -ον",
          "first_occurrence": [
            38,
            2
          ]
        },
        {
          "book_entry": "Ἀχαιός, -ά",
          "first_occurrence": [
            39,
            2
          ]
        },
        {
          "book_entry": "βάρβαρος, -ον",
          "first_occurrence": [
            18,
            2
          ]
        },
        {
          "book_entry": "Βοιώτιος, -α",
          "first_occurrence": [
            48,
            4
          ]
        },
        {
          "book_entry": "Γαλάτης, Γαλάτισσα",
          "first_occurrence": [
            29,
            5
          ]
        },
        {
          "book_entry": "Γραικός, -ή",
          "first_occurrence": [
            51,
            5
          ]
        },
        {
          "book_entry": "Δωριεύς, Δωρίς",
          "first_occurrence": [
            39,
            3
          ]
        },
        {
          "book_entry": "ἐθνικός, -ή, -ον"
        },
        {
          "book_entry": "Ἑλλαδικός, -ή, -όν",
          "first_occurrence": [
            63,
            5
          ]
        },
        {
          "book_entry": "Ἐφέσιος, -α",
          "first_occurrence": [
            50,
            1
          ]
        },
        {
          "book_entry": "Θεσσαλός, -ίς",
          "first_occurrence": [
            48,
            2
          ]
        },
        {
          "book_entry": "Θηβαῖος, -α",
          "first_occurrence": [
            105,
            7
          ]
        },
        {
          "book_entry": "Ἴβηρ, Ἰβηρίς",
          "first_occurrence": [
            32,
            7
          ]
        },
        {
          "book_entry": "Ἴων, Ἰωνίς"
        },
        {
          "book_entry": "Κιτιεύς, Κιτίς",
          "first_occurrence": [
            123,
            6
          ]
        },
        {
          "book_entry": "Κορίνθιος, -α",
          "first_occurrence": [
            45,
            1
          ]
        },
        {
          "book_entry": "Κρής, Κρῆσσα"
        },
        {
          "book_entry": "Κύπριος, -α",
          "first_occurrence": [
            123,
            1
          ]
        },
        {
          "book_entry": "Λέσβιος, Λεσβίς",
          "first_occurrence": [
            114,
            6
          ]
        },
        {
          "book_entry": "Μῆδος, Μηδίς"
        },
        {
          "book_entry": "Μιλήσιος, -α"
        },
        {
          "book_entry": "Πάριος, -α"
        },
        {
          "book_entry": "Πέρσης, Περσίς"
        },
        {
          "book_entry": "Ῥόδιος, -α"
        },
        {
          "book_entry": "Ῥωμαῖος, -α"
        },
        {
          "book_entry": "Σάμιος. -α"
        },
        {
          "book_entry": "Σμυρναῖος, -α"
        },
        {
          "book_entry": "Σύριος, -α"
        },
        {
          "book_entry": "τοπικός, -ή, -όν",
          "first_occurrence": [
            99,
            2
          ]
        }
      ]
    },
    {
      "section": "Ῥήματα",
      "words": [
        {
          "book_entry": "αἰολίζω",
          "first_occurrence": [
            112,
            4
          ]
        },
        {
          "book_entry": "ἀποδοκιμάζω"
        },
        {
          "book_entry": "ἀττικίζω",
          "first_occurrence": [
            117,
            3
          ]
        },
        {
          "book_entry": "βαρβαρίζω",
          "first_occurrence": [
            26,
            7
          ]
        },
        {
          "book_entry": "βασιλεύω",
          "first_occurrence": [
            79,
            4
          ]
        },
        {
          "book_entry": "γεννάω",
          "first_occurrence": [
            75,
            4
          ]
        },
        {
          "book_entry": "διαφέρω"
        },
        {
          "book_entry": "δωρίζω",
          "first_occurrence": [
            101,
            4
          ]
        },
        {
          "book_entry": "ἑλληνίζω",
          "first_occurrence": [
            9,
            5
          ]
        },
        {
          "book_entry": "ἐπίσταμαι",
          "first_occurrence": [
            2,
            5
          ]
        },
        {
          "book_entry": "ἰωνίζω",
          "first_occurrence": [
            107,
            4
          ]
        },
        {
          "book_entry": "λαλέω",
          "first_occurrence": [
            2,
            3
          ]
        },
        {
          "book_entry": "μερίζω",
          "first_occurrence": [
            73,
            5
          ]
        },
        {
          "book_entry": "ὀνομάζω, -ομαι",
          "first_occurrence": [
            63,
            1
          ]
        },
        {
          "book_entry": "προσαγορεύω",
          "first_occurrence": [
            95,
            6
          ]
        }
      ]
    },
    {
      "section": "Προθέσεις",
      "words": [
        {
          "book_entry": "περί (+ αἰτ.)"
        }
      ]
    },
    {
      "section": "Ἀντωνυμίαι",
      "words": [
        {
          "book_entry": "ὅσοι, ὅσαι, ὅσα",
          "first_occurrence": [
            17,
            3
          ]
        }
      ]
    },
    {
      "section": "Ἐπιρήματα",
      "words": [
        {
          "book_entry": "ἑλληνιστί",
          "first_occurrence": [
            6,
            6
          ]
        },
        {
          "book_entry": "πέραν",
          "first_occurrence": [
            77,
            4
          ]
        },
        {
          "book_entry": "πρότερον",
          "first_occurrence": [
            71,
            8
          ]
        }
      ]
    },
    {
      "section": "Φράσεις",
      "words": [
        {
          "book_entry": "Χαλεπὰ τὰ καλά",
          "first_occurrence": [
            36,
            1
          ]
        }
      ]
    }
  ]
}