{
  "chapter_name": "ΟΙ ΠΑΙΔΕΣ",
  "word_list_page_number": 192,
  "exercise_page_range": [
    188,
    191
  ],
  "sections": [
    {
      "section": "Ῥήματα",
      "words": [
        {
          "book_entry": "ἄγω"
        },
        {
          "book_entry": "αἱρέω"
        },
        {
          "book_entry": "ἀλγέω"
        },
        {
          "book_entry": "ἀποχωρέω"
        },
        {
          "book_entry": "βοηθέω"
        },
        {
          "book_entry": "βούλομαι"
        },
        {
          "book_entry": "γεωργέω"
        },
        {
          "book_entry": "διδάσκω"
        },
        {
          "book_entry": "δύναμαι"
        },
        {
          "book_entry": "ἐργάζομαι"
        },
        {
          "book_entry": "ἥκω"
        },
        {
          "book_entry": "ἰλιγγιάω"
        },
        {
          "book_entry": "κάθημαι"
        },
        {
          "book_entry": "κατασκευάζω"
        },
        {
          "book_entry": "μισέω"
        },
        {
          "book_entry": "οἶδα"
        },
        {
          "book_entry": "πίπτω"
        },
        {
          "book_entry": "πταῖω"
        },
        {
          "book_entry": "φημί"
        }
      ]
    },
    {
      "section": "Ἐκφράσεις",
      "words": [
        {
          "book_entry": "οὐ γὰρ οὖν!"
        },
        {
          "book_entry": "τί ἔστιν;"
        }
      ]
    },
    {
      "section": "Ὀνόματα",
      "words": [
        {
          "book_entry": "ἄγαλμα, τό"
        },
        {
          "book_entry": "ἀγγεῖον, τό"
        },
        {
          "book_entry": "ἀστρονόμος, ὁ"
        },
        {
          "book_entry": "βοήθεια, ἡ"
        },
        {
          "book_entry": "γλύπτης, ὁ"
        },
        {
          "book_entry": "διδασκαλεῖον, τό"
        },
        {
          "book_entry": "διδάσκαλος, ὁ"
        },
        {
          "book_entry": "κεραμεύς, ὁ"
        },
        {
          "book_entry": "λόγος, ὁ"
        },
        {
          "book_entry": "_μετοχή, ἡ_"
        },
        {
          "book_entry": "ναύτης, ὁ"
        },
        {
          "book_entry": "ὄχθη, ἡ"
        },
        {
          "book_entry": "πλοῖον, τό"
        },
        {
          "book_entry": "προθυμία, ἡ"
        },
        {
          "book_entry": "στρατηγός, ὁ"
        },
        {
          "book_entry": "τάφος, ὁ"
        },
        {
          "book_entry": "φόβος, ὁ"
        }
      ]
    },
    {
      "section": "Ἐπιφωνήματα",
      "words": [
        {
          "book_entry": "αἰαῖ!"
        },
        {
          "book_entry": "φεῦ!"
        }
      ]
    },
    {
      "section": "Ἐπιρρήματα",
      "words": [
        {
          "book_entry": "δεῦρο"
        }
      ]
    },
    {
      "section": "Κύρια ὀνόματα",
      "words": [
        {
          "book_entry": "Ἀγαμέμνων, ὁ"
        },
        {
          "book_entry": "Ἀκρόπολις, ἡ"
        },
        {
          "book_entry": "Ἀναξίμανδρος, ὁ"
        },
        {
          "book_entry": "Ἀρχέλαος, ὁ"
        },
        {
          "book_entry": "Κεραμεικός, ὁ"
        },
        {
          "book_entry": "Λακεδαίμων, ἡ"
        },
        {
          "book_entry": "Λεωνίδας, ὁ"
        },
        {
          "book_entry": "Λύσιππος, ὁ"
        },
        {
          "book_entry": "Μενέλαος, ὁ"
        },
        {
          "book_entry": "Πλάτων, ὁ"
        },
        {
          "book_entry": "Πραξιτέλης, ὁ"
        }
      ]
    },
    {
      "section": "Ἐπίθετα",
      "words": [
        {
          "book_entry": "ἀκίνητος, -ον"
        },
        {
          "book_entry": "Λακεδαιμόνιος, -α"
        },
        {
          "book_entry": "Μακεδών, Μακεδόνισσα"
        },
        {
          "book_entry": "ξένος, -η, -ον"
        },
        {
          "book_entry": "ὅλος, -η, -ον"
        }
      ]
    },
    {
      "section": "Προθέσεις",
      "words": [
        {
          "book_entry": "ἐκτός"
        },
        {
          "book_entry": "ἐντός"
        },
        {
          "book_entry": "πρός + δοτ."
        }
      ]
    }
  ]
}