{
  "chapter_name": "ΠΕΡI ΕΙΡΗΝΗΣ",
  "word_list_page_number": 364,
  "exercise_page_range": [
    358,
    363
  ],
  "sections": [
    {
      "section": "Ῥήματα",
      "words": [
        {
          "book_entry": "ἀναμένω"
        },
        {
          "book_entry": "ἀπαγγέλλω"
        },
        {
          "book_entry": "ἀπογράφω, -ομαι"
        },
        {
          "book_entry": "δέω"
        },
        {
          "book_entry": "διαπράσσω, -ομαι"
        },
        {
          "book_entry": "ἐγκαθίστημι"
        },
        {
          "book_entry": "ἐπιτελέω"
        },
        {
          "book_entry": "ἥδομαι"
        },
        {
          "book_entry": "καταπολεμέω, -ομαι"
        },
        {
          "book_entry": "λακωνίζω"
        },
        {
          "book_entry": "μεταγράφω"
        },
        {
          "book_entry": "μεταπέμπω, -ομαι"
        },
        {
          "book_entry": "οἶμαι"
        },
        {
          "book_entry": "ὄμνυμι"
        },
        {
          "book_entry": "ὁμογνωμονέω"
        },
        {
          "book_entry": "παρακαλέω"
        },
        {
          "book_entry": "παρέρχομαι"
        },
        {
          "book_entry": "προηγορέω"
        },
        {
          "book_entry": "προσκρούω"
        },
        {
          "book_entry": "ὑποτάσσω, -ομαι"
        },
        {
          "book_entry": "φαίνομαι"
        },
        {
          "book_entry": "φιλονικέω"
        },
        {
          "book_entry": "φρονέω"
        }
      ]
    },
    {
      "section": "Ὀνόματα",
      "words": [
        {
          "book_entry": "ἀμάρτημα, τό"
        },
        {
          "book_entry": "ἀρμοστής, ὁ"
        },
        {
          "book_entry": "αὐτονομία, ἡ"
        },
        {
          "book_entry": "γνώμη, ἡ"
        },
        {
          "book_entry": "διοικητής, ὁ"
        },
        {
          "book_entry": "δυσκολία, ἡ"
        },
        {
          "book_entry": "κατάλυσις, ἡ"
        },
        {
          "book_entry": "πράξις, ἡ"
        },
        {
          "book_entry": "πρεσβεία, ἡ"
        },
        {
          "book_entry": "σιωπή, ἡ"
        },
        {
          "book_entry": "ταραχή, ἡ"
        },
        {
          "book_entry": "φρουρά, ἡ"
        }
      ]
    },
    {
      "section": "Ἀντωνυμίαι",
      "words": [
        {
          "book_entry": "ὑμεῖς"
        }
      ]
    },
    {
      "section": "Μόρια",
      "words": [
        {
          "book_entry": "ἄρα"
        }
      ]
    },
    {
      "section": "Σύνδεσμοι",
      "words": [
        {
          "book_entry": "ἐάν (εἰ - ἄν)"
        }
      ]
    },
    {
      "section": "Προθέσεις",
      "words": [
        {
          "book_entry": "ἀντί"
        }
      ]
    },
    {
      "section": "Ἐπίθετα",
      "words": [
        {
          "book_entry": "ἄδικος, -ον"
        },
        {
          "book_entry": "ἀναμάρτητος, -ον"
        },
        {
          "book_entry": "ἀνάξιος, -ον"
        },
        {
          "book_entry": "ἀντίτυπος, -ον"
        },
        {
          "book_entry": "ἄπρακτος, -ον"
        },
        {
          "book_entry": "αὐτόνομος, -ον"
        },
        {
          "book_entry": "εὔπορος, -ον"
        },
        {
          "book_entry": "σχολαῖος, -α, -ον"
        },
        {
          "book_entry": "σώφρων, -ον"
        }
      ]
    },
    {
      "section": "Ἐπιρρήματα",
      "words": [
        {
          "book_entry": "ἀθύμως"
        },
        {
          "book_entry": "ἄλλως"
        },
        {
          "book_entry": "ἀφρόνως"
        },
        {
          "book_entry": "δήπου"
        },
        {
          "book_entry": "δίς"
        },
        {
          "book_entry": "ἐμποδών"
        },
        {
          "book_entry": "πολεμικῶς"
        },
        {
          "book_entry": "πρόσθεν"
        },
        {
          "book_entry": "πως"
        },
        {
          "book_entry": "ὑμέτερος, -α, -ον"
        },
        {
          "book_entry": "σωφρόνως"
        }
      ]
    }
  ]
}