{
  "chapter_name": "Η ΥΠΑΤΙΑ",
  "word_list_page_number": 124,
  "exercise_page_range": [
    120,
    123
  ],
  "sections": [
    {
      "section": "Ὀνόματα",
      "words": [
        {
          "book_entry": "ἀγορά, ἡ"
        },
        {
          "book_entry": "ἀθλητής, ὁ"
        },
        {
          "book_entry": "ἄνθος, τό"
        },
        {
          "book_entry": "ἄροτρον, τό"
        },
        {
          "book_entry": "γέρων, ὁ"
        },
        {
          "book_entry": "γραῦς, ἡ"
        },
        {
          "book_entry": "δίσκος, ὁ"
        },
        {
          "book_entry": "ἔτος, τό"
        },
        {
          "book_entry": "ἱμάτιον, τό"
        },
        {
          "book_entry": "ἱματιοπώλης, ὁ"
        },
        {
          "book_entry": "κιθαριστής, ὁ"
        },
        {
          "book_entry": "κλῆρος, ὁ"
        },
        {
          "book_entry": "κρήνη, ἡ"
        },
        {
          "book_entry": "οἰκονόμος, ὁ / ὴ"
        },
        {
          "book_entry": "ποίημα, τό"
        },
        {
          "book_entry": "πόνος, ὁ"
        },
        {
          "book_entry": "τροφός, ἡ"
        }
      ]
    },
    {
      "section": "Ἀντωνυμίαι",
      "words": [
        {
          "book_entry": "οὗτος, αὕτη, τοῦτο"
        },
        {
          "book_entry": "ποῖος; ποία; ποῖον;"
        }
      ]
    },
    {
      "section": "Ἐπίθετα",
      "words": [
        {
          "book_entry": "ἀγαθός, -ή, -όν"
        },
        {
          "book_entry": "Ἀθηναῖος, -α, -ον"
        },
        {
          "book_entry": "ἀνδρεῖος, -α, -ον"
        },
        {
          "book_entry": "ἀνήσυχος. -ον"
        },
        {
          "book_entry": "ἄσχημος. -ον"
        },
        {
          "book_entry": "δεινός, -ή, -όν"
        },
        {
          "book_entry": "δύσκολος, -ον"
        },
        {
          "book_entry": "ἐπιδέξιος, -ον"
        },
        {
          "book_entry": "ἤσυχος, -ον"
        },
        {
          "book_entry": "ἰσχυρός, -ά, -όν"
        },
        {
          "book_entry": "_κτητικός, -ἤ, -ον_"
        },
        {
          "book_entry": "πλούσιος, -α, -ον"
        },
        {
          "book_entry": "ῥᾴθυμος, -ον"
        },
        {
          "book_entry": "φιλάνθρωπος, -ον"
        },
        {
          "book_entry": "φιλόπονος, -ον"
        },
        {
          "book_entry": "χῆρος, -α, -ον"
        }
      ]
    },
    {
      "section": "Ἐπιρρήματα",
      "words": [
        {
          "book_entry": "ἀεί"
        },
        {
          "book_entry": "ἄριστα"
        },
        {
          "book_entry": "μάλα"
        },
        {
          "book_entry": "οὔπω"
        }
      ]
    },
    {
      "section": "Ῥήματα",
      "words": [
        {
          "book_entry": "ᾄδω"
        },
        {
          "book_entry": "ἀροτρεύω"
        },
        {
          "book_entry": "διοικέω"
        },
        {
          "book_entry": "ἐσθίω"
        },
        {
          "book_entry": "θηλάζω"
        },
        {
          "book_entry": "κιθαρίζω"
        },
        {
          "book_entry": "κλαίω"
        },
        {
          "book_entry": "πλύνω"
        },
        {
          "book_entry": "πονέω"
        },
        {
          "book_entry": "πωλέω"
        },
        {
          "book_entry": "συλλέγω"
        }
      ]
    },
    {
      "section": "Ἀριθμοί",
      "words": [
        {
          "book_entry": "ἑβδομήκοντα"
        },
        {
          "book_entry": "εἴκοσι"
        },
        {
          "book_entry": "ἑξήκοντα"
        },
        {
          "book_entry": "πεντεκαίδεκα"
        },
        {
          "book_entry": "τεσσαράκοντα"
        },
        {
          "book_entry": "τριάκοντα"
        }
      ]
    },
    {
      "section": "Προθέσεις",
      "words": [
        {
          "book_entry": "κατά (καθ ̓ ἡμέραν)"
        }
      ]
    }
  ]
}