{
  "chapter_name": "Ο ΚΥΚΛΩΨ",
  "word_list_page_number": 145,
  "exercise_page_range": [
    141,
    144
  ],
  "sections": [
    {
      "section": "Ῥήματα",
      "words": [
        {
          "book_entry": "ἀδικέω"
        },
        {
          "book_entry": "ἀναβοάω"
        },
        {
          "book_entry": "ἀνακαίω"
        },
        {
          "book_entry": "ἀπέρχομαι"
        },
        {
          "book_entry": "ἀποβαίνω"
        },
        {
          "book_entry": "ἀποξύνω"
        },
        {
          "book_entry": "ἀποπλέω"
        },
        {
          "book_entry": "βάλλω"
        },
        {
          "book_entry": "βοάω"
        },
        {
          "book_entry": "βυθίζω"
        },
        {
          "book_entry": "εἰσβαίνω"
        },
        {
          "book_entry": "εἰσελαύνω"
        },
        {
          "book_entry": "ἐκλύω"
        },
        {
          "book_entry": "ἐξέρχομαι"
        },
        {
          "book_entry": "ἐπανέρχομαι"
        },
        {
          "book_entry": "ἐπιζητέω"
        },
        {
          "book_entry": "καίω"
        },
        {
          "book_entry": "καταντάω"
        },
        {
          "book_entry": "κεραννύω"
        },
        {
          "book_entry": "κοιμάομαι"
        },
        {
          "book_entry": "κρύπτω, -ομαι"
        },
        {
          "book_entry": "μανθάνω"
        },
        {
          "book_entry": "μεθύω"
        },
        {
          "book_entry": "μηνίω"
        },
        {
          "book_entry": "νομίζω"
        },
        {
          "book_entry": "παραγίγνομαι"
        },
        {
          "book_entry": "πάσχω"
        },
        {
          "book_entry": "περιρρέω"
        },
        {
          "book_entry": "πλανάω, -άομαι"
        },
        {
          "book_entry": "προσπελάζω"
        },
        {
          "book_entry": "προστίθημι"
        },
        {
          "book_entry": "σώζω, -ομαι"
        },
        {
          "book_entry": "τρίβω"
        },
        {
          "book_entry": "τυφλόω"
        },
        {
          "book_entry": "φοβέω, -έομαι"
        }
      ]
    },
    {
      "section": "Ὀνόματα",
      "words": [
        {
          "book_entry": "ἀσκός, ὁ"
        },
        {
          "book_entry": "βασιλεύς, ὁ"
        },
        {
          "book_entry": "βοή, ἡ"
        },
        {
          "book_entry": "γαστήρ, ἡ"
        },
        {
          "book_entry": "δόλος, ὁ"
        },
        {
          "book_entry": "ἐπεισόδιον, τό"
        },
        {
          "book_entry": "ἑταῖρος, ὁ"
        },
        {
          "book_entry": "κρατήρ, ὁ"
        },
        {
          "book_entry": "κριός, ὁ"
        },
        {
          "book_entry": "λίθος, ὁ"
        },
        {
          "book_entry": "μέτωπον, τό"
        },
        {
          "book_entry": "ναῦς, ἡ"
        },
        {
          "book_entry": "ὀφθαλμός, ὁ"
        },
        {
          "book_entry": "ποίμνιον, τό"
        },
        {
          "book_entry": "ῥόπαλον, τό"
        },
        {
          "book_entry": "στόμαχος, ὁ"
        }
      ]
    },
    {
      "section": "Ἐπίθετα",
      "words": [
        {
          "book_entry": "ἄκρατος, -ον"
        },
        {
          "book_entry": "ἀνδροφάγος, -ον"
        },
        {
          "book_entry": "γλυκύς, -εἴα, τύ"
        },
        {
          "book_entry": "διάπυρος, -ον"
        },
        {
          "book_entry": "ἔνδοξος, -ον"
        },
        {
          "book_entry": "ἡδύποτος, -ον"
        },
        {
          "book_entry": "λευκός, -ή, τόν"
        },
        {
          "book_entry": "λυπηρός, -ά, -όν"
        },
        {
          "book_entry": "λωτοφόγος, -ον"
        },
        {
          "book_entry": "οὐρητικός, -ή, -όν"
        },
        {
          "book_entry": "πεπτικός, -ή, -όν"
        },
        {
          "book_entry": "πολύτροπος, -ον"
        },
        {
          "book_entry": "συνήθης, -ες"
        },
        {
          "book_entry": "_σύνθετος, -ον_"
        },
        {
          "book_entry": "τρόφιμος, -η, -ον"
        },
        {
          "book_entry": "τυφλός, -ή, -όν"
        },
        {
          "book_entry": "ὑπέρμεγας, -άλη, -αν"
        },
        {
          "book_entry": "ὑπερμεγέθης, -ες"
        },
        {
          "book_entry": "ὑστεραίος, -α, τον"
        }
      ]
    },
    {
      "section": "Κύρια ὀνόματα",
      "words": [
        {
          "book_entry": "Θοώσα, ἡ"
        },
        {
          "book_entry": "Ὀδύσσεια, ἡ"
        },
        {
          "book_entry": "Ἴλιον, τό"
        },
        {
          "book_entry": "Λαέρτης, ὁ"
        },
        {
          "book_entry": "Ὀδυσσεύς, ὁ"
        }
      ]
    },
    {
      "section": "Ἐπιρρήματα",
      "words": [
        {
          "book_entry": "οὕτω(ς)"
        },
        {
          "book_entry": "πέριξ"
        },
        {
          "book_entry": "πλησίον"
        },
        {
          "book_entry": "ταχέως"
        }
      ]
    },
    {
      "section": "Φράσεις",
      "words": [
        {
          "book_entry": "ἐκ τούτου"
        },
        {
          "book_entry": "τῇ ὑστεραίᾳ"
        }
      ]
    },
    {
      "section": "Ἀντωνυμίαι",
      "words": [
        {
          "book_entry": "οὔτις"
        }
      ]
    },
    {
      "section": "Ἀριθμοί",
      "words": [
        {
          "book_entry": "δώδεκα"
        }
      ]
    },
    {
      "section": "Προθέσεις",
      "words": [
        {
          "book_entry": "ἀπό + γεν."
        },
        {
          "book_entry": "εἰς"
        },
        {
          "book_entry": "ἐπί + γεν."
        },
        {
          "book_entry": "μετά + γεν."
        },
        {
          "book_entry": "ὑπό + γεν. / αἰτ."
        }
      ]
    }
  ]
}