{
  "chapter_name": "ΑΝΔΡΕΣ ΚΑΙ ΓΥΝΑΙΚΕΣ",
  "word_list_page_number": 32,
  "exercise_page_range": [
    28,
    31
  ],
  "sections": [
    {
      "section": "Ὀνόματα",
      "words": [
        {
          "book_entry": "ἀνήρ, ὁ",
          "first_occurrence": [
            1,
            3
          ]
        },
        {
          "book_entry": "_γένος, τό_"
        },
        {
          "book_entry": "γυνή, ἡ",
          "first_occurrence": [
            7,
            7
          ]
        },
        {
          "book_entry": "κόρη, ἡ",
          "first_occurrence": [
            26,
            2
          ]
        },
        {
          "book_entry": "νεανίας, ὁ",
          "first_occurrence": [
            25,
            5
          ]
        },
        {
          "book_entry": "παῖς, ὁ/ἡ",
          "first_occurrence": [
            18,
            6
          ]
        },
        {
          "book_entry": "παιδίον, τό",
          "first_occurrence": [
            20,
            4
          ]
        }
      ]
    },
    {
      "section": "Ἐπίθετα",
      "words": [
        {
          "book_entry": "ἀθάνατος, -ον",
          "first_occurrence": [
            43,
            6
          ]
        },
        {
          "book_entry": "_ἀρσενικός, -ή, -όν_"
        },
        {
          "book_entry": "_θηλυκός, -ή, -όν_"
        },
        {
          "book_entry": "θνητός, -ή, -όν",
          "first_occurrence": [
            43,
            3
          ]
        },
        {
          "book_entry": "κακός, -ή, -ον",
          "first_occurrence": [
            32,
            2
          ]
        },
        {
          "book_entry": "καλός, -ή, -όν",
          "first_occurrence": [
            31,
            5
          ]
        },
        {
          "book_entry": "_οὐδέτερος, -τέρα, -τερον_"
        }
      ]
    },
    {
      "section": "Ἄρθρον",
      "words": [
        {
          "book_entry": "ὁ, ἡ, τό | οἱ, αἱ, τά",
          "first_occurrence": [
            15,
            6
          ]
        }
      ]
    },
    {
      "section": "Ἀριθμοί",
      "words": [
        {
          "book_entry": "δύο",
          "first_occurrence": [
            3,
            2
          ]
        },
        {
          "book_entry": "τρεῖς",
          "first_occurrence": [
            6,
            3
          ]
        }
      ]
    },
    {
      "section": "Σύνδεσμοι",
      "words": [
        {
          "book_entry": "γάρ",
          "first_occurrence": [
            25,
            3
          ]
        },
        {
          "book_entry": "ἤ",
          "first_occurrence": [
            66,
            5
          ]
        },
        {
          "book_entry": "οὔτε ... οὔτε",
          "first_occurrence": [
            24,
            3
          ]
        }
      ]
    },
    {
      "section": "Μόρια",
      "words": [
        {
          "book_entry": "οὖν",
          "first_occurrence": [
            13,
            3
          ]
        }
      ]
    },
    {
      "section": "Κύρα ὀνόματα",
      "words": [
        {
          "book_entry": "Ἀπολλόδωρος, ὁ"
        },
        {
          "book_entry": "Ἀπολλώνιος, ὁ"
        },
        {
          "book_entry": "Ἑλένη, ἡ"
        },
        {
          "book_entry": "Ἠλέκτρα, ἡ"
        },
        {
          "book_entry": "Καλλίμαχος, ὁ"
        },
        {
          "book_entry": "Καλλιρρόη, ἡ"
        },
        {
          "book_entry": "Κασσάνδρα, ἡ",
          "first_occurrence": [
            22,
            3
          ]
        },
        {
          "book_entry": "Πάτροκλος, ὁ",
          "first_occurrence": [
            22,
            6
          ]
        },
        {
          "book_entry": "Ὑπατία, ἡ",
          "first_occurrence": [
            17,
            4
          ]
        },
        {
          "book_entry": "Φίλιππος, ὁ",
          "first_occurrence": [
            4,
            1
          ]
        }
      ]
    }
  ]
}